,Video ID,Title,Channel,Upload date,Stock,Summary,Company,Symbol
54,DoZVR4K0-5A,"Paramount could be a good long-term due to sports content, says Payne Capital's Courtney Garcia",CNBC Television,2024-02-28 21:00:55+00:00,482,"earnings exchange with paramount global, hp, inc. and birkenstock. on deck here with our trade is courtney garcia, senior wealth advisor and cnbc contributor. We will start with paramount. shares are on pace for fourth straight negative week. a strategic budget could be in the cards as the streaming ads decelerate.",Paramount,PARA
55,mY8xkGciYeU,"G Squared's Victoria Greene says Costco is a buy, here's why",CNBC Television,2024-03-07 19:32:30+00:00,23,"Baird expects accelerating discretionary numbers. broadcom shares, more than doubling over the past year. docusign, which broke a losing streak last week, jeopardy watching enterprise demand and competition as last week's rumor of a buyout not come to fruition and cut 6% of its workforce.",Costco,COST
56,Vqc7qktK6g4,"Amazon's addition to the Dow doesn't answer questions around AI, says Deepwater's Gene Munster",CNBC Television,2024-02-26 16:16:53+00:00,4,"Amazon is in clear third place when it comes to the ai cloud behind microsoft and google, gene munster, deepwater managing partner, joins us now covers all the mag seven stocks. If nothing else, just a sign of the times. that amazon joins the sDMou.",Amazon,AMZN
57,Vqc7qktK6g4,"Amazon's addition to the Dow doesn't answer questions around AI, says Deepwater's Gene Munster",CNBC Television,2024-02-26 16:16:53+00:00,215,"as you said, it's a nice, prestigious identity for them to be a part of the dow. but again the punch power, the bevenchmarking power of bei added to the dow, is 0.01 less than the s&p 500.",Dow,DOW
58,5BGiGuDbYmM,"Calls of the Day: Some bullish calls on Netflix, Eli Lilly, General Electric and Snowflake",CNBC Television,2024-02-27 19:09:59+00:00,27,netflix price increase from 570.. ubs: new 52-week high today jason snipe- you own the stock >> to me. they're the clear winner in the space: 29 million new subs in 2023. lilly price target to 850 from 680.. i don't think i need to tell you why there's so much optimism around this stock. it is getting expensive.,Netflix,NFLX
59,xYVImuGQjSQ,Costco reports after the bell: Here's what you need to know,CNBC Television,2024-03-07 21:51:21+00:00,23,"Consumers of costco hitting an all time high ahead of reporting results. Several analysts, raising price targets based on a strong start of sales and possibility of membership increase grade. greg mellick joins me now: how high is the bar? i guess would be the initial question. i think the expectations are high for good reason: there was consistent traffic growth.",Costco,COST
60,wTlWoSlifz0,"Apple is at a lull right now in terms of disruptive innovation, says Rosenblatt's Barton Crockett",CNBC Television,2024-03-05 13:29:59+00:00,1,"Apple is at a crossroads right. now. they need to come up with a really kind of interesting ai innovation at their worldwide developer conferencein june. i think that the easiest thing for apple to do is talk about the processing power in their devices. if that moves the needle and stimulates more business, more demand for iphones and macs is where i think the real benefit could come.",Apple,AAPL
61,hFfDJ63UCcY,"Target shares pop as retailer boosts profits, despite lackluster sales forecast",CNBC Television,2024-03-05 13:01:59+00:00,107,"target just reporting earnings for the quarter. it came in at $2.98a share. revenue: also beat expectations at $31.9 billion. The stock is up sharply at 5.8%, probably because of the current quarter is better than expected, but also because the profit margins have gotten better for 2023.",Target,TGT
62,nxZWfoYfYmg,Calls of the Day: Salesforce and CVS,CNBC Television,2024-02-26 18:56:13+00:00,26,"i think that salesforce is going to benefit from the acquisition of mule soft several years back in the ai adoption. i think the cash potential is the reason to own the stock. shares recently got knocked down off of 82, and that was on the back of the fourth quarter resul.",Salesforce,CRM
63,aFzKqm7P5-k,Final Trades: Alphabet and Union Pacific,CNBC Television,2024-03-04 18:21:17+00:00,3,"i would own puts in alphabet if you were long the stock. if you do own the puts, i'd keep them, and i still think it goes lower. and two winners in the race of ai for everyday tools, google and microsoft. it's foolish to sell based.",Alphabet,GOOGL
64,hHV5E3NiDbg,"Salesforce is our top pick as a generative AI pure play, says Stefan Slowinksi",CNBC Television,2024-02-29 12:59:13+00:00,26,"we are still out perform on salesforce. We see 27% upside wit. we see a gen ai play, we see the products coming available. you know it is exciting to see that starting to come through for Salesforce. we are seeing more momentum across the industry with gen-ai hype and buzz turning.",Salesforce,CRM
65,IwKb3Ul8twg,"The UnitedHealth hack helped push Palo Alto Networks higher, says Jim Cramer",CNBC Television,2024-02-27 00:59:05+00:00,100,"i see these things happen pretty much every day, which is a big reason why you can't just write off palo alto networks at 100 points in a day, or 400% micron. these moves are all signs emblematic of a bubble, but company is doing much better than expected. stocks are doing up on rational experience, not on irrational.",Palo Alto,PANW
66,0k-WNjugGCg,"Target's profitability is returning back to where it was historically, says UBS' Michael Lasser",CNBC Television,2024-03-05 15:13:12+00:00,107,Target's stock is up 8.3% after the company's fourth quarter profit and revenue beats. The company's traffic was down 2% this quarter after being down mid-single digits for the last few quarters. The profitability of this business is returning back to where it was historically.,Target,TGT
67,XsH1eCaAXus,"Apple will find ways to 'essentially charge developers anyway,' says Deepwater's Gene Munster",CNBC Television,2024-03-04 20:17:53+00:00,1,"Apple is under pressure after being hit with a $2 billion fine for antitrust violations. Gene munster: Investors are voting that they don't have confidence in apples ai strategy. Munster: Apple will use ai to make better predictive text and add the fit and finish around their hardware. i suspect that will frustrate and in for a great some developers. i have been closely watching what has happened: canada, us, south korea, japan, the eu. apple is really smart. they will go and make changes to accommodate the courts but then they find ways to essentially charge the developers anyway.",Apple,AAPL
68,OYxzpItDEwg,"Apple pulling out of EV project was the right move, says Wedbush's Dan Ives",CNBC Television,2024-02-28 16:13:05+00:00,1,"Reports say apple is winding down the electric car project. This after ten years shifting some of the people on that effort to ai. gill lori, a neutral rating on the stock, dan ives of course our viewers know he likes apple- has a price target of 250.",Apple,AAPL
69,SwhoDdrRmCo,"Lowe’s beats earnings estimates even as sales fall, company expects revenue to slide again",CNBC Television,2024-02-27 13:10:55+00:00,57,"lowe's is out. i tried to get a quote and there is a big spread with the big and ask if we get a determination where it is trading. i don't know if that is a real trade. the numbers on face value you look good. 1.77 is what the company reported. over $1.68 as the estimate down from last year, as far as year over year results. The estimate for revenue was $18.45 billion. The company reported It wasn't that long ago that my team and i downgraded lowe's and home depot on the idea of the near-term euphoria. we think this may be a bit opt optimist, as i think how 2024 plays out here. the fundamental softness we have seen could persist longer. that is when you see the stocks get under pressure.",Lowe,LOW
70,puMuXWKl6sA,"Super Micro needs to figure out a differentiator, says Wedbush's Matt Bryson",CNBC Television,2024-03-04 22:48:47+00:00,146,"Supermicro's market cap is now in the 80 billion range, but would it take for a company like this would be -- what kind of margins with the need to have more sales with they have to have in order for that to be reasonable? can they figure out some kind of differentiator so they look like apple ios or they look. like microsoft windows for's servers?",Super Micro,SMCI
71,5Ho5S4n-asI,"Move on from Apple, tactically: Renaissance Macro Research CEO",CNBC Television,2024-03-04 21:18:25+00:00,1,"Apple is a big name, part of the mag 7, and it's the weakest of them all. i think you want to move on from apple tactically. it's not far behind but it is far behind them. this isn't about the next 30 years.",Apple,AAPL
72,pHmIoQBjUJw,Cramer’s Stop Trading: Moderna,CNBC Television,2024-02-26 15:58:11+00:00,223,"david: moderna hsbc downgrades it to a sell. zoom, another name that reports this week. livenation very close to the four-year anniversary when all of us exited. i've got alongco pet and clear this morning and huntington bank from steve steinour on barry.",Moderna,MRNA
73,S0_g8vdKk6A,"Apple doesn't necessarily need to be a leader in generative AI, says Bernstein's Toni Sacconaghi",CNBC Television,2024-03-05 14:28:23+00:00,1,"apple was hit with a nearly $2 billion fine from european regulators over music streaming. toni sacconaghi bernstein, senior research analyst, joins joe to discuss the stock. i'm worried that there was a bit of a sea change is there or once again, demise is being greatly exaggerated, says toni. apple is introducing new services every year. whether they're media services or financial services, they're deepening penetration. that trifecta of being able to sell services in new parts of the world, raise price, skand, introduce new services likely means that business can grow double digits for several more years.",Apple,AAPL
74,Et8c_2ykWG4,"Still a question over how AI will be integrated into Alphabet's products, says former Google VP",CNBC Television,2024-02-27 16:39:54+00:00,3,"i think it's an interesting time for the company around some of the these products and how they operate. i think it is still a question how these kinds of technologies get integrated into their flagship products, search being one of the biggest ones people are going to pay attention to. i do think google has less of a history of that and they also have taken a cautious approach with their non-search products over the years.",Alphabet,GOOGL
75,Droj7JKC04o,Trade Tracker: Josh Brown sells McDonald's and Zoom,CNBC Television,2024-03-07 18:41:05+00:00,36,"McDonald's will be fine. It will have a good year. It's not a cheap stock but it shouldn't be. i'm not bearish on mcdonald's. what else do we want to do? >> shake shack- by the way, you can't talk about one. -- >> i can't sell it. >> listen to me now and believe me later.",McDonald's,MCD
76,EUHNEsJPWZk,"Warner Bros. Discovery-Paramount deal was never really on to begin with, says Puck's Matt Belloni",CNBC Television,2024-02-28 13:26:59+00:00,336,"warner bros, discovery is no longer in talks with pair mount global, joining us right now is puck's matt bellamy. i think both of these companies are exploring whatever there is to explore at this point, looking at whoever it is they're looking to talk to. it was surprising that sources would say it was off just because it was never really on to begin with.",Warner Bros,WBD
77,EUHNEsJPWZk,"Warner Bros. Discovery-Paramount deal was never really on to begin with, says Puck's Matt Belloni",CNBC Television,2024-02-28 13:26:59+00:00,482,"i think paramount goes to david ellison, skydance and the redbird group. paramount and the company come taft joint venture of sorts with paramount and peacock. i think warner's has to look to comcast and see if brian roberts is looking to do a deal with them.",Paramount,PARA
78,3pjlHhiJUcI,"Investors revaluing Tesla as a hardware company instead of a software company, says Ross Gerber",CNBC Television,2024-03-05 01:10:57+00:00,11,"Tom and -- tom, starting with you. What is wrong with the stock? Tom: ""This is more than a car company. it's a autonomy company"" tom: ""The model 3 and model y largely saturated. There will be growth in 2024.. that, still, is significantly off the 40% growth that they did in 2023""",Tesla,TSLA
79,62-tvBGb59I,"Trade Tracker: Kari Firestone trims Meta, Adobe and adds to Paycom",CNBC Television,2024-02-28 19:07:44+00:00,5,you trimmed meta weiss. i want to hear from kari on meta >>. it was a portfolio decision. it had been a great stock- telephones- our largest position. it got to a level that was just unbelievably cheap. we believe in the company and didn't want it to be in the position. and we trimmed it.,Meta,META
80,62-tvBGb59I,"Trade Tracker: Kari Firestone trims Meta, Adobe and adds to Paycom",CNBC Television,2024-02-28 19:07:44+00:00,30,you trimmed adobe >>. adobe is slightly different. it proved to be a really strong stock. portfolio management decision plus. we understand that there are issues about ai being the text-to-video format and what competition might come their way. you trimmed ad Adobe >>.,Adobe,ADBE
81,62-tvBGb59I,"Trade Tracker: Kari Firestone trims Meta, Adobe and adds to Paycom",CNBC Television,2024-02-28 19:07:44+00:00,454,"we don't know about that specifically, but it adds risk. and up added to paycom >>. after, it wa. after. We're not sure if that's true, but if it is, we don't want to know. We want to make sure we're doing the right thing for our customers.",Paycom,PAYC
82,sBUc8uMr3lc,Boeing reportedly in talks to buy Spirit Aerosystems,CNBC Television,2024-03-01 19:00:31+00:00,78,"Boeing is in talks to buy spirit aero after the door plug incident on an alaska airlines flight back in january. ""The country needs boeing to be successful. the airline industry knows it, and by that i mean the global airline industry,"" Jim says.",Boeing,BA
83,Jfs7DyEMBEs,HPE CEO Antonio Neri on mixed Q1 results: A big chunk of AI shipments are deferred,CNBC Television,2024-03-01 14:34:44+00:00,315,"Hewlett Packard Enterprise reports fiscal first quarter beat and sales dropped more than 13% from a year ago. hb forecasting quarter revenue below expectations joining us. sir looking at stock, which has fallen about 5% on the back of this news. Mr. Packard, i'm excited about independent closure of the juniper acquisition.",Hewlett Packard Enterprise,HPE
84,lwZmQUS0HSI,"Walmart is a 'much more diversified' company than Target, says CFRA's Arun Sundaram",CNBC Television,2024-03-05 15:47:52+00:00,107,target reported 5.8% operating margins this quarter- the strongest this year and moving in the right directions. i think the big question is when discretionary sales will improve. that's what's needed to improve the top and bottom line. walmart is much more exposed to food and beverage category versus target.,Target,TGT
85,lwZmQUS0HSI,"Walmart is a 'much more diversified' company than Target, says CFRA's Arun Sundaram",CNBC Television,2024-03-05 15:47:52+00:00,12,"i think walmart is a much more diversified company than target. we talked about sales. mix is different. walmart has the club model, sam's club. they have an international business as well. it has a third-party marketplace much larger advertising business. that's where the margins are.",Walmart,WMT
86,pFsP1cvJQvs,"Occidental Petroleum CEO talks the CrownRock deal, Chevron and Hess and natural gas prices",CNBC Television,2024-02-27 21:54:44+00:00,25,"i was surprised when natural gases were five dollars or above, i was surprise the prices were below two dollars. i think this is a short-term thing. i don't think any of these deals that are being proposed today create any trust issues. we have the chemicals business that is ahead from the low front. we can make ore money and chemicals when gas is low gases and have so much of an impact.",Chevron,CVX
87,8UwYxS9wffc,Target CEO Brian Cornell on earnings beat: We've seen a very resilient U.S. consumer,CNBC Television,2024-03-05 13:49:41+00:00,107,"target is out with better than expected fourth quarter results. it was much better than the 242 the street was expecting, also beating expectations. joining us is brian cornell, target's chairman and ceo. that stock by the way up by 7.6% so far this morning. We are putting a lot of time into ensuring we have the right balance of newness and that's whether you are stopping in the stores or online. The consumer is still looking at value propositions and you are looking at a consumer. a little pinches come again. i think our entire team has learned how important is it to listen to the consumer. and we value the relationship we have with the guests that love shopping at target. we have to listen to the consumer and be on trend and understand how things are changing and being in the retail business today social is a big role on what people buy. if becky is wearing a wh,",Target,TGT
88,KGcoOQ2-ah8,Chevron-Hess deal in jeopardy? Here's what to know,CNBC Television,2024-02-27 13:08:48+00:00,25,exxon could spoil the chevron deal to purchase hess for $53 billion. Chevron is warning investors the deal could be in jeopardy. The terms were signed a decade ago. i don't know if the rights exist. to make the call today will be very difficult. you know to see which one is.,Chevron,CVX
89,KGcoOQ2-ah8,Chevron-Hess deal in jeopardy? Here's what to know,CNBC Television,2024-02-27 13:08:48+00:00,186,"Exxon claims it should have the right of first refusal over the deal with hess, because hess owns 45% of the venture in guyana. The timing that lapsed between when this was initially announced and now exxon making a call that. i don't cover hess see how that stock will continue to progress.",Hess,HES
90,V55ZMNPOujM,EU regulators fining Apple €1.8 billion over Apple Music,CNBC Television,2024-03-04 13:29:09+00:00,1,Apple was fined $1.8 billion by the european commission. The fine is over apple music in europe. Apple is going to appeal the decision. The eu agrees more with spotify. This is just one beat in just this big drama between these companies. Apple has 2.7 trillion dollars on its stock. The company is under pressure to comply with European Commission rules. Apple has no story to tell in the same way that microsoft has. Apple is an important sign for your 401(k) and my 401(K),Apple,AAPL
91,3yT-838RSj0,Boeing and Spirit Aerosystems confirm merger talks,CNBC Television,2024-03-01 22:01:05+00:00,78,"Boeing and spirit aerosystems confirm they are in merger talks. tony -- airspace and defense. epf -- portfolio manager. i think strategically it makes a lot of sense, i think in the near term there is no silver bullet, but i think this is probably the right thing long term.",Boeing,BA
92,AG7yXT3Dg6A,Fmr. Discover chief risk officer discusses what went wrong at NYCB,CNBC Television,2024-03-01 19:15:14+00:00,256,"Brian hughes, the former chief risk officer at discover, talks about the new open banking rules. hughes: The rules will allow banks to safely -- allow consumers to safely- share information with banks that will allow them to make more fair and more informed underwriting decisions. The rules are expected to be finalized sometime this year.",Discover,DFS
93,-ClEa_WH4js,"Spirit Aerosystems needs to come in-house to be better managed by Boeing, says Jefferies' Kahyaoglu",CNBC Television,2024-03-01 21:41:08+00:00,78," spirit has been at the center of quality issues affecting boeing 737 max gastronomy. i think, given the faa audit is in week 46,. there is a doj investigation. there is clearly a lot of manufacturing mishaps going on. boEing has to bring speared in-house.",Boeing,BA
94,F3aLkb5GELY,The economy is resilient and fine but feels soft: Moody's Mark Zandi,CNBC Television,2024-03-06 19:05:01+00:00,124,,Moody's,MCO
95,sxG5THYWvL4,Trade Tracker: Josh Brown buys McDonald's,CNBC Television,2024-02-26 18:57:02+00:00,36,"i really like the technical setup here. mcdonald's in december had an investor day and the plan going forward is to grow this company at the fastest rate ever. i think it will punch through and when it does, probably not many sellers will be left. i am hoping we can stay long in this name, because i think fundamentally and technically it has what it takes.",McDonald's,MCD
96,qh3tI49EiXQ,Goodstein: A company with cash like Berkshire should sit tight and look for the best opportunity,CNBC Television,2024-02-26 12:37:51+00:00,6,"Warren buffett is a value investor and many of our members are value investors. he is looking for opportunities for something that is under valued, with long-term growth potential. i want to ask about berkshire hathaway being in conglomerate. are you worried this company will suffer conglomerate diskd discounts?",Berkshire,BRK-B
97,cLWT3iaMDHM,"Target's initiatives will bring the company growth, says Morgan Stanley's Simeon Gutman",CNBC Television,2024-03-05 17:24:42+00:00,107,"The retailer is taking share from all of the above: kraft, hardy, probably some in sporting goods, apparel- we think all those categories together- plus food, i should say. beauty along with partnership with ulta, has been driving significant share gains. that continues the target store in the strip mall.",Target,TGT
98,eDDvGFLo-F0,Republic Services CEO Jon Vander Ark: We've moved from a waste company to a sustainability company,CNBC Television,2024-02-28 13:55:43+00:00,148,"republic services forecasting better than expected. revenue for the year attributed high demand for garbage collection and disposal. Revenue for year attributed to high demand. for garbagecollection and disposal, according to public services forecast. For confidential support call the Samaritans in the UK on 08457 90 90 90 or visit a local Samaritans branch, see www.samaritans.org for details.  john vander ark, republic services ceo for years, talks about the company's strong outlook. He says the company has moved from a waste company to a recycling and waste company. The company added more than 15,000 jobs over that period, as well, he says.",Republic Services,RSG
99,rytrswAfB60,Apple iPhone sales plunge 24% in China,CNBC Television,2024-03-05 17:37:17+00:00,1,"Apple shares slip again after a report of weak iphone sales in china. Apple already warned. iphones globally will be off by about $5 billion in the current march quarter, and we already saw how ugly china was in the holiday quarter last year. huawei, still small market share in ch China but taking share from apple and other competitors.",Apple,AAPL
100,78U3w4LZQzM,FTC sues to block Kroger-Albertsons merger: Here's what to know,CNBC Television,2024-02-27 13:32:34+00:00,217,"filed a lawsuit to block the merger over kroger and albertson's. joining us, kathy o'neal, former, senior director, and people are separated on this. There are people that say the elephant in the room is walmart. kathy: The ftc is looking at a narrow slice of the market.",Kroger,KR
101,_eylwxTnxuk,Apple hit with a European Union antitrust fine of nearly $2 billion,CNBC Television,2024-03-04 18:46:29+00:00,1,"Apple is facing a $2 billion us fine and 1.8 in euros. The fine puts at risk 10% of annual global revenue from these companies. Apple points out in their statement that spotify has 56% of the european streaming music market. If what they're hinting at is spotify is alleging antitrust behavior, how exactly does the next chapter play out in this appeal process?",Apple,AAPL
102,eTWcK2zeNTY,DOJ probing Boeing over door plug blowout incident: Here's what to know,CNBC Television,2024-02-29 13:24:34+00:00,78,"boeing shares are slightly lower this morning, after reports that the justice department is looking into the door plug blowout incident on an alaska airlines flight last month. This is fairly serious because it goes back to an agreement they had from years ago- several years ago. This could raise some new problems and potentially criminal charges.",Boeing,BA
103,zfB6yaIO9yo,"Jeff Bezos becomes the world's richest man again, passing over Tesla CEO Elon Musk",CNBC Television,2024-03-05 20:40:45+00:00,11,"what's happening with tesla and how it affects elon musk and amazon stock. can you take us through some of the movement that we are seeing in the world's richest ranks? at one point, you know the arnos were doing well for themselves. warren buffett, bill, gates in that mix as well.",Tesla,TSLA
104,HSCfgduwi2c,Kroger CEO Rodney McMullen on FTC lawsuit: We were disappointed but not surprised,CNBC Television,2024-02-28 17:55:48+00:00,217," rodney mcmullen, kroger's ceo, says merger is good for customers, associates and communities. ftc says acquisition of albertson's would lead to additional grocery price hikes for everyday goods, further exacerbating the financial strain consumers across the country face today.",Kroger,KR
105,_V1YC1rC6_I,"Transportation Sec. Buttigieg on airline mergers, Boeing's woes and Pres. Biden's economic record",CNBC Television,2024-03-05 15:17:14+00:00,78,"FAA administrator met with the senior leadership of boeing, communicated some real concerns about what seems to be their inability to comply with the kind of quality control practices that faa expects of them. gave them 90 days to present a comprehensive plan and show how they're going to move forward to cure these issues. The president will give the state of the union address on Thursday. Faa says the president needs to take more credit for the good things happening in the economy. He says Congress needs to focus on the things that are going right and stop using the bad things to score political points.",Boeing,BA
106,D5Qkvn4GYiQ,Cramer’s Mad Dash: Dollar Tree,CNBC Television,2024-03-04 15:04:35+00:00,273,i happen to be a dollar tree fan. i went by my dollar general this weekend because it's not functional. they don't have enough inventory. my dollar tree is chock-full. i think you're totally right. but they can get rid of all the bad family dollars.,Dollar Tree,DLTR
