,Video ID,Title,Channel,Upload date,Stock,Summary,Company,Symbol
0,YEoJq_PcOgc,What can reignite Apple shares?,CNBC Television,2024-02-28 17:55:38+00:00,1,"i don't expect anything to happen at the shareholders' meeting today to see a catalyst for that. i think what we need is, in june at the wwdc, to hear about the ai innovation- and you had a little bit of a glimpse into it yesterday. if apple is able to confidently communicate to its investor base how we're going to incorporate ai into the iphone 16, it will absolutely restart the momentum in the stock. Apple has been flat for three years, according to analyst Jenny Weiss. Weiss: Apple has not been working on incorporating artificial intelligence into the iphone. ""i think we're just missing the potential"" of the company, Weiss says. ""There's just nothing in there that's compelling"" i suspect them following again. we don't even know the use cases for ai other than at the highest level, other than searching, for you know books or answers to questions with microsoft and chatgpt. nobody was focused on the car. it's been ten years in the making and it shows to me that the apple brand has atrophied a little bit. i know it will be controversial. if you go back 15 years ago, every auto company would have been",Apple,AAPL
1,BOm0zNiaNjg,Alphabet's AI problems: Stock falls 4%,CNBC Television,2024-02-26 19:01:28+00:00,3,"The stock of alphabet is down 4%. The stock never recovered from the earnings report. In silicon valley, stock prices become the perception that drives stock prices in the short-term can always cross over and become reality. There's a problem at alphabet. They did way too much hiring and imported a virus.",Alphabet,GOOGL
2,cTncTPylZQ8,Apple shares touch a 4-month low,CNBC Television,2024-03-05 17:54:20+00:00,1,"i'm not particularly very bullish on the eye wear they've come out with. this is a mid-20s multiple. i've had about half the market weight in it. i suspect it's around 160. when it does, when it bottoms out, i will be adding to it. there is no fatal flaw here. i didn't expect them to be leading the charge on ai. they've never done so. this happens again and again. i laugh at the downgrades. the stock has been incredible. it has six months a year where it doesn't give you much. i can live with that. iReporter: Apple has really set us up to no longer look at hand sets but look at services. i think josh has a great point here. apple is more than willing to let its competitors find the proof of concept and then monetize it. No other electronic consumer company in my opinion that will be able to create such a strong install base.",Apple,AAPL
3,qAITe2Hn8Hc,"Three-Stock Lunch: Broadcom, Kroger & Costco",CNBC Television,2024-03-07 20:47:58+00:00,217,"Kroger is up 23% over the past month. This has really gotten ahead of itself and the albertsons deal really seems to be in trouble. Another reason to wait for a pullback is that the price is very reasonable: 12.3, much lower than target.",Kroger,KR
4,qAITe2Hn8Hc,"Three-Stock Lunch: Broadcom, Kroger & Costco",CNBC Television,2024-03-07 20:47:58+00:00,23,"finally, costco reporting results after the bell today. this is more of a tumor, stable, but has actually had a decent run. it had a wonderful run, which is why it is time to sell. i remember when we were waiting for walmart to grow in its valuat.",Costco,COST
5,G573i2zmNkk,"Committee stocks on the move: Costco, Eli Lilly, Netflix, Google and Gold",CNBC Television,2024-03-08 18:20:25+00:00,23,"costco mixed quarter. jason snipe rev. miss seems everybody loves this stock, you included. does this change your mind in any way? >> no, i think this is really an overreaction. the stock is more susceptible to market conditions than idiosyncratic conditions for itself.",Costco,COST
6,G573i2zmNkk,"Committee stocks on the move: Costco, Eli Lilly, Netflix, Google and Gold",CNBC Television,2024-03-08 18:20:25+00:00,27,"barclays has a note that says it could be a bigger winner for youtube than for netflix. i wouldn't be surprised if youtube is a leader. the play on linear tv, the only pull i believe, is live, live sports live business. i think these are all positive catalysts for them.",Netflix,NFLX
7,fIw6XBGxfhw,"Three-Stock Lunch: Biogen, DocuSign & Gap",CNBC Television,2024-03-08 20:21:17+00:00,263,"The biogen stock shares are down over 10% this year. The postpartum depression drug has not performed as expected. gap inc share are popping after. the holiday sales were good. The stock is still down, despite the move in 2024 but shares up more than 80% over the past six months.",Biogen,BIIB
8,DbzX64TystQ,"The big question facing Warner Bros. Discovery is whether it can grow, says Tom Rogers",CNBC Television,2024-02-26 14:44:16+00:00,336,"i think the time may be coming that they have to own up to whether renaming the streaming srd max was the best idea here. i think there's a lot of indication in terms of pure engagement. despite all the emmys that they win, there's still a percentage of television time where they if need to get much more.",Warner Bros,WBD
9,ftSzI6MP7mo,"Three Stock Lunch: Hewlett Packard, Dell, and Boeing",CNBC Television,2024-03-01 21:06:45+00:00,78,Boeing is in talks to buy trouble supplier spirit aerosystems. shares of boeing. down today. A troubled company buying a troubled company does not make a good company. i've never been a fan of this company. they have a tremendous amount of debt again just when you start getting comfortable about orders.,Boeing,BA
10,6OnjUyzSPKo,Capital Wealth's Kevin Simpson breaks down buying opportunities in Apple on weakness,CNBC Television,2024-03-05 21:59:06+00:00,1,"Scott: Apple is the same stop that we had sold to get into broadcom. Scott: apple is down about 15% since the beginning of november, so this is an opportunity for us to rebuild our apple position here. scott: i think 160 is where we are going to have an opportunity to backfill this particular position for us. McDonald's and visa are among the stocks the firm is looking to buy. The company is offering premiums in excess of 5%. The stock market is stretched, but there is a lot of momentum behind it, he says. The earnings statement is fairly decent, even though all the economic data isn't perfect.",Apple,AAPL
11,EUcIbKO4M5A,"Expect more near-term downward pressure on Tesla stock, says Wells Fargo's Colin Langan",CNBC Television,2024-03-05 19:08:51+00:00,11,"let's talk about tesla first, because it is a driver of the market, if you will. i think in the near term we're talking about another year until at least the model two comes. so the stock really lacks a clear catalyst over that period. so there's still going to be some downward pressure the stock but there's risk/rewards to the name.",Tesla,TSLA
12,NvSK3iHdXcM,Here's why Apple should be in your portfolio,CNBC Television,2024-03-04 18:53:55+00:00,1,"Apple is shutting down its car ambitions and will shift resources to artificial intelligence. Apple is a supplier that gets a whole lot of eyeballs on things that run ai. i'm glad they're back to understanding what they do, and this feels very microsoft, says Kim.",Apple,AAPL
13,0WQSSp_wYrA,Apple unveils 'world's best consumer laptop for AI',CNBC Television,2024-03-04 17:37:21+00:00,1,"Investors are getting impatient, searching for apple's ai strategy, the release of an ai laptop highlights, an up sale cycle and the idea that apple can leverage ai features to its products. The street is divided on whether that can get apple caught up in the ai race.",Apple,AAPL
14,PuQx9vs9Aek,"Apple's slump is a buying opportunity, says Wedbush's Dan Ives",CNBC Television,2024-03-06 01:40:09+00:00,1,"Apple has a huge target on its back, despite the fact that it must spend hundreds of millions on manufacturing it. The chinese government has effectively banned government employees from using iphones, at least from their job role. Apple is going to introduce a wwdc in june, the start of an ai app store and incorporate ai into iphone.",Apple,AAPL
15,UO7utWSxZDg,Costco shares slip after quarterly earnings report,CNBC Television,2024-03-07 23:18:54+00:00,23,"Costco shares are lower in overtime- just over 4% at the moment. The stock has run up a lot, so i think expectations were high. costco is lowering prices, especially on discretionary goods. that will drive morse door traffic and, most importantly, it will drive membership income and renewal rates.",Costco,COST
16,tixpZyKhQok,Wells Fargo's Mike Mayo on why Citi is his top bank stock pick,CNBC Television,2024-03-08 14:32:38+00:00,75,"speaking at a conference, also saying citi's reorganization will be complete by end of this month. Citi is going from this matrix management structure, all of these countries and functions, to five lines of business, very simple services. by the end, citi will have made all the major decisions about where people stand. citi's selling off revenues equal to that procter & gamble, according to our expert at wells fargo, a challenged company. If she doesn't get a 10% return- double-digit return- in three years from now, could be out of a job, but if she gets returns, should be banker of the year.",Citi,C
17,tixpZyKhQok,Wells Fargo's Mike Mayo on why Citi is his top bank stock pick,CNBC Television,2024-03-08 14:32:38+00:00,34,"i'm walking around the wells fargo equity research floor and we have dozens and dozens's analysts. and then i find the consumer staples analyst, chris carrie. sounds like procter & gamble. several years ago, had functions, went to six lines of business. citi's selling off revenues equal to that proctor & gamble, according to our expert.",Wells Fargo,WFC
18,SWJiz-QKSF8,"Three-Stock Lunch: Super Micro Computer, Deckers Outdoor, and Viking Thera",CNBC Television,2024-03-04 20:52:04+00:00,307,"Viking Therapeutics is a company that is emerging as a strong weight loss drug player. The stock is up by almost 300% over the course of the past month. deckers outdoor is another name that will be joining the s&p 500, this is behind uggs.",Deckers Outdoor,DECK
19,dAMRdOlfJPo,Apple bull vs. bear debate: What's next for the company?,CNBC Television,2024-03-01 14:57:00+00:00,1,"join us for a bear debate over apple. dan flax, newberger, berman research analyst, looked high and low. walter piecheck, analyst. do you feel lonely? anybody else a bear on apple? really, walter? that's heresy. i'm not definitely putting a lot on the shoulders of ai, which we have no information today. i mean just talk to the operators and people are holding on ththeir iphones longer to the company's credit. i can't even believe that yeah people don't even talk about the possibility. that apple's not the answer to everything.",Apple,AAPL
20,gbTEmNWLfvE,The not-so Magnificent 7: Alphabet and Apple,CNBC Television,2024-02-27 18:02:55+00:00,3,"i think there is a lot of opportunity for google to right the ship. i fully agree with what rob is saying on alphabet and the parallels to meta should not be lost on the audience. they have not streamlined or got fit. there are problem, problematic ideas that have nothing to do with running a business successfully.",Alphabet,GOOGL
21,gbTEmNWLfvE,The not-so Magnificent 7: Alphabet and Apple,CNBC Television,2024-02-27 18:02:55+00:00,1,"Apple stock is up 1.5%. The company has a shareholder meeting tomorrow. Apple is not recognized as an ai player yet, steph says. Steph: i've been underweight forever, but have been add to go it down: 10% from the highs.",Apple,AAPL
22,_VBMkDiGCq8,"Final Trades: Comcast, AT&T, Amazon and the XLE",CNBC Television,2024-03-07 18:34:33+00:00,4,"yes, at&t >> jimmy >> amazon >> thank you for that. i think it gets the rotation and pays good dividends so as rates come down. look at it. robert downey jr. best supporting actor. sunday night >> home team >> i.",Amazon,AMZN
23,_VBMkDiGCq8,"Final Trades: Comcast, AT&T, Amazon and the XLE",CNBC Television,2024-03-07 18:34:33+00:00,70,"yes, at&t >> jimmy >> amazon >> thank you for that. i think it gets the rotation and pays good dividends so as rates come down. look at it. robert downey jr. best supporting actor. sunday night >> home team >> i.",AT&T,T
24,zw_lqqw7Ob4,"The EV market has gone 'from optimistic to realistic', says former Ford CEO Mark Fields",CNBC Television,2024-03-08 14:12:29+00:00,169,,Ford,F
25,D92lE_X4DlQ,Amazon joins Dow 30: Here's what investors should know,CNBC Television,2024-02-26 13:25:51+00:00,4,Amazon is the top pick if you step back. amazon went into the major investment cycle as they aggressively invested in next day and same dayand several hour delivery that really trashed its free cash flow margins. e-bay trades at a reasonable 12 times earnings multiple. The better marketplace is amazon.,Amazon,AMZN
26,D92lE_X4DlQ,Amazon joins Dow 30: Here's what investors should know,CNBC Television,2024-02-26 13:25:51+00:00,215,"we should really glean from going into the dow 30?. what does this mean? >>. i just think it is representation. i'm not sure what it means, but i think it's good to have a sense of what's going on. i don't know what it says, but it's a good thing.",Dow,DOW
27,K0yGRDUu0G0,"Alphabet has an attractive valuation, but is a 'show me' stock, says BakerAvenue's King Lip",CNBC Television,2024-02-27 21:54:06+00:00,3,"Alphabets, one of the top holdings, has had more missteps related to the rollout. We continue this as being attractive. This is somewhere from 10 to 15% below what we think is fair evaluation. The company has significant resources to be a leader in the ai arms race.",Alphabet,GOOGL
28,MqXL5MQ-0WI,"Apple, Google and Tesla are now becoming un-magnificent, says says Alger's Crawford",CNBC Television,2024-02-28 22:19:58+00:00,1,"apple. not the only mega cap stock lower today - alphabet trailing the group and adding to its losses for the year. ankur crawford, executive vice president and manager, says bifurcation is set to continue. i would argue that meta is more compelling than apple today in terms of the growth and valuation relative to apple.",Apple,AAPL
29,MqXL5MQ-0WI,"Apple, Google and Tesla are now becoming un-magnificent, says says Alger's Crawford",CNBC Television,2024-02-28 22:19:58+00:00,11,"that is what we are seeing right now with apple, google and tesla. there goes the curve. >> well, amazon is in apple, Google and TESla. just for now. >> just forNow. that's what we're seeing. That's what's happening right now.",Tesla,TSLA
30,PE8e2nZ5C6Q,Trade Tracker: Josh Brown buys more Pfizer,CNBC Television,2024-03-05 18:32:27+00:00,53,"josh brown says pfizer is one of the best opportunities in the entire market. The stock is on the 52-week low list and at an 11-year low. i don't even know if i'm done buying it yet, but i added to my position by about 50% yesterday. i am a buyer under 30 and we'll see what happens in the coming years.",Pfizer,PFE
31,EpEgo2I410U,"OpenAI shares Elon Musk emails urging startup to raise $1 billion, see Tesla as a cash cow",CNBC Television,2024-03-06 13:04:59+00:00,11,"the tesla ceo encouraged the startup to raise at least a billion dollars in funding. in one email in 2018, musk wrote: openai had no chance of becoming a competitor to google's deepmind without relative changes. last week, he accused the company and ceo, sam altman, from deviating from its initial mission by keeping the worksen of its post.",Tesla,TSLA
32,Bm0inOkyYxE,"Top-line growth and AI will determine where Salesforce's stock goes from here, says George Seay",CNBC Television,2024-02-28 12:21:28+00:00,26,"The salesforce.com report is expected to beat on revenue and earnings, but is it still a big deal? ""They've made some progress here, frank, but they've got more. they could potentially do, but i think we're kind of on the margins at this point,"" says George.",Salesforce,CRM
33,5Ns1eij9gqk,"Technical Support: BAC, AXP & KO",CNBC Television,2024-02-27 20:39:20+00:00,49,"Next up, we have american express above its third largest. We had an area of consolidation that we broke out over. No longer are there any lower lows or lower highs. That is a lot of bullish momentum. We have to support right here. run the 188 level. we are getting into the super highs based on previous trends.",American Express,AXP
34,wDWaTwiBoVw,Chart Master: What's next for Apple,CNBC Television,2024-02-29 23:22:16+00:00,1,"Since all-time high last december, apple has been underperforming the s&p 500 by more than 15%. could the so-called benchmark stock be signaling a downturn? let's go to the chart master. hi carter >>. hi there, well, you know, there's an expression in the southern united states. this dog won't hunt, and that's the circumstance with apple.",Apple,AAPL
35,_zNulk5FQWw,"Calls of the Day: IBM, UnitedHealth and Deere",CNBC Television,2024-03-07 18:42:26+00:00,46,"ibm is where. we're starting price target to 185 at bernstein, from 165.. a rerating, they say, driven by improved operating performance and competitive positioning. lilly around a high almost every day, too even though it may pullback slightly on the novo news. that's where the action seems to be.",IBM,IBM
36,_zNulk5FQWw,"Calls of the Day: IBM, UnitedHealth and Deere",CNBC Television,2024-03-07 18:42:26+00:00,81,"Jimmy says he's not selling deere, but he's looking for that umph. The stock is down 6.5% year to date. The reason to own the stock for the long run is precision farming, he says. ""i hate being so tied to crop prices and weather patterns at this valuation""",Deere,DE
37,UpzXHkliqZA,Apple snapping 7-day losing streak,CNBC Television,2024-03-08 18:31:42+00:00,1,i think what's interesting is all this news about china. i think has all been priced into the stock. they will figure out an ai solution for the iphone. it's just coming later on. they're watching everyone else. this is a clear referendum on tesla. you're not see.,Apple,AAPL
38,L6dpSXOnjbU,"Eli Lilly could be the next stock to cross $1 trillion, says Jim Cramer",CNBC Television,2024-02-27 00:16:51+00:00,7,"eli lilly has a serious chance of passing a trillion dollars. the insurers club is recognizing that the weight loss drugs are being used. responsibility to combat diabetes and obesity, hypertensive, the copd, fatty liver disease and a couple other conditions we don't even know. i'm sorry, they don't make it.",Eli Lilly,LLY
39,nP4gYJ31omI,Cramer’s Mad Dash: Salesforce,CNBC Television,2024-02-26 15:02:16+00:00,26,Salesforce has two upgrades ahead of the quarter and the problem with that is the 28th. 40% of their business at n Nvidia is. can you infer? i ask you a question and they're asked trillions of questions which would say what would make it so that you would buy more. that's how they use ai and i think it'spretty -- it's pretty impressive.,Salesforce,CRM
40,_JVgNT_VsHc,"Without transparency, it's hard to trust Apple and Google, says Alex Kantrowitz",CNBC Television,2024-02-28 12:48:47+00:00,1,"i'm going to google skunkworks right now, when it comes to apple, give me a sense. i think it's been a corporate issue that's held apple back from building an electric car or autonomous car. apple's actually asking shareholders to vote no on this because they're worried about revealing some of their competitive position. iowas want to know how the algorithm works and who's involved with it. iowa wants to know if alphabet needs to release a report creating more transparency. iowas: If google gets away with not telling us how the algorithms works, or failing in the past, it needs to tell us now. going forward is to maintain trust.",Apple,AAPL
41,gzBon0qM7Ag,Wells Fargo's Mike Mayo offers his top bank stock picks,CNBC Television,2024-02-26 21:34:34+00:00,34,,Wells Fargo,WFC
42,d27ZNyvyFpE,"Trade Tracker: Bill Baruch buys Salesforce and more AMD, Nvidia & Western Digital",CNBC Television,2024-02-29 17:54:10+00:00,26,"Bill Baruch is one of the members of the committee that bought salesforce. Baruch says he bought the company to gain more software exposure. He says he's impressed with how the stock has performed and Benioff's excitement. Baroch: If this gets out above its previous high, it could start to run from a price perspective.",Salesforce,CRM
43,d27ZNyvyFpE,"Trade Tracker: Bill Baruch buys Salesforce and more AMD, Nvidia & Western Digital",CNBC Television,2024-02-29 17:54:10+00:00,318,"i'm re-establishing an overweight position here. let it set until after earnings, and this is very, very tactical. i want to see this in a very constructive bull flag, like pattern. if we start surrendering the middle february his, then i would look to manage this position.",Western Digital,WDC
44,4l60ncIz7co,Cramer’s Mad Dash: Boeing,CNBC Television,2024-02-29 16:23:42+00:00,78,"The justice department is looking into it to see whether they violated the deferred prosecution agreement of a couple years ago. Someone could see the faa in the actual manufacturing of the plane. That is criminal, that is not civil, what i think is most interesting. The question is: had they deceived the regulators.",Boeing,BA
45,vQSZbyDVPpo,Cramer’s Stop Trading: HP,CNBC Television,2024-02-29 17:01:49+00:00,272,"Jensen huang of n Nvidia is speaking at a user conference next week. i think that there's a protein revolution to go with the documentary. i have hormel on tonight, the star of the s&p. jeff martin delivered the best of the utility quarters i've seen.",HP,HPQ
46,ICE6qqDCFsM,Citi's Chronert: A lot supports our bullish stance on S&P fundamental strength,CNBC Television,2024-03-05 16:31:29+00:00,75,"scott crowner, citi's us equity strategist, joins us at post nine, his bull case 5700.. scott, great to have you. good to be here. we were talking. the house view at citi on the macro side has been cautious for a while, and yet you are looking to be potentially more constructive. why is that? we've been table pounding bullish on s&p 500 for a year now.",Citi,C
47,LacPFD2ZDEs,"Apple needs to do something big and Rivian might be the answer, says Deepwater's Gene Munster",CNBC Television,2024-02-28 01:46:03+00:00,1,"Apple announced it is selling its stake in deepwater asset management company tesla. ross gerber, jean Munster and gene gerber weigh in on the news. What do you think? Is it a good move for apple or a bad one? Share your thoughts in the comments below. i think apple could have done something really special when it comes to automotive -- >>. i think the rivian that lines up 10, $12 billion market cap, definitely more doable, and i think it does line up. i am disappointed that this turn in events and i don't want to be predicting that they are ultimately going to do something like this.",Apple,AAPL
48,kKILXnL8D9M,Trade Tracker: Kevin Simpson trims Broadcom and buys more IBM,CNBC Television,2024-03-08 18:15:42+00:00,8,"Broadcom's revenues were expected to be $38 billion previously. That got jumped up to $50 billion- explosive growth, definitely nice things. We're looking at a stock that's fairly priced, so for that reason, we've been exiting the position. If it gets to $900, that's probably where it should be trading. that's going to be an uncomfortable drop to watch.",Broadcom,AVGO
49,kKILXnL8D9M,Trade Tracker: Kevin Simpson trims Broadcom and buys more IBM,CNBC Television,2024-03-08 18:15:42+00:00,46," ibm trades at under three times sales over the past six quarters. they've seen free cash flow grow from $7 billion to $12 billion. we'd like to see the dividend growth. see them grow. they're getting ai exposure through red hat. watson x- the stock didn't do anything for what. three, four, five years.",IBM,IBM
50,WsTCJokwEGA,Clockwise's James Cakmak holds bullish case for Amazon,CNBC Television,2024-02-26 19:10:52+00:00,4,The e-commerce of retail will continue to go from analog to digital and over 50% of those dollars are captured by amazon. The real sexy part about this whole story is amazon web services. We were at 12% and 13% last quarter and we think it will just continue to incrementally grow higher from here.,Amazon,AMZN
51,-CSjFtE-Bag,Cantor's Sarah James names Cigna and Elevance as health insurer stocks to watch,CNBC Television,2024-02-26 20:42:49+00:00,89,Cigna just won the big contract away from cvs. We are heading into a period of investments where they are going to rely on each other for shared services. A key area is glp-1's that is a huge amount for a single drug class. That's an area they are focusing: re-down the price a.,Cigna,CI
52,QYcnW8rNfx4,Chart of the Day: Target,CNBC Television,2024-03-05 17:58:15+00:00,107,"Stephanie link, chief investment strategist at Hightower, joins us now to discuss this trade. Casey's general store is a gas and convenience store chain in the midwest. The stock is still down 37% from november of 2021, and you only have 20 buys on the stock.",Target,TGT
53,VtB0h6bCiGY,"Alphabet would be dramatically higher if it was willing to embrace efficiency, says Jim Cramer",CNBC Television,2024-02-28 00:55:27+00:00,3,"i don't even want to call it alphabet anymore, because they never change the symbol. here's something to ponder how many outpost's, how many warrants are buried in this sprawling intellectual playground. you been fooling around with your fitbits charge six tracker for $159.99.. is this the one you want? google wasting his time on? and then you have garmin- truly a great use of brainpower. jim: i've been following you and listening to you for 19 years. i have an energy play market. cap is phenomenal. a ratio of 13.47.. it makes money, like you say. $1.09 per share, operates the national gas pipeline and transportation wondering. if this is a good investment work you would recommend nothing else.",Alphabet,GOOGL
