,Video ID,Title,Channel,Upload date,Stock,Summary,Company,Symbol
107,C7-Hpgu9Ezo,"Maybe we shouldn't be surprised Domino's can give us such encouraging numbers, says Jim Cramer",CNBC Television,2024-02-27 01:15:24+00:00,383,that is positive and that propels the session we had: a strong quarter from domino's what and a much better long term quote than anyone expected. i-25% dividend boost and a buyback optimization which is pretty substantial for 16 million dollar company. i'm not saying look at one of these pauses that bails of said every single day. they did not see it.,Domino's,DPZ
108,ZD3D9fqKUa8,"Partnership with Walmart will help enhance breast cancer detection, says Radnet CEO Howard Berger",CNBC Television,2024-03-02 00:40:50+00:00,12,"now breast screen service inside walmart. that's where people can go and that is a great place. people can get detection by going to walmart >>. well, we think not only will that be more convenient for patients. but there is perhaps one third of the female population that should be getting routine breast screening.",Walmart,WMT
109,6joVbGA2nKw,"Why Apple stock is an 'opportunity,' and Boeing is a 'trap': Main Street Research's CIO",Yahoo Finance,2024-03-09 00:46:20+00:00,1,"The shares are down about 10% or so year to date. i think that investors are misunderstanding about apple. where are they going really in this, what we call the new tech, le ai bull market. first, it starts with ai subscriptions, probably in q2. q3 is really exciting because that's going to be uh iphone 16. i think that's what apple's doing here. they're saying, you know, let's give up on the driverless car and the 1010 billion that we threw at that. where are they refocusing it? ai. i think that if they don't, um, make magic happen in the next few quarters, i think it's the ai, uh, play um the stock definitely obe at risk.",Apple,AAPL
110,6joVbGA2nKw,"Why Apple stock is an 'opportunity,' and Boeing is a 'trap': Main Street Research's CIO",Yahoo Finance,2024-03-09 00:46:20+00:00,78,"i'm talking about boeing. those shes down more than 20% of your to dat. but you say no, you don't want to get in here. let's talk about why. what's been going on production wise at the company? yeah, i mean, you know, it takes decades to build a great reputation and it takes moments to ruin it.",Boeing,BA
111,uoTKkw9ic7c,Walmart's 3-for-1 stock split goes into effect,Yahoo Finance,2024-02-26 15:43:00+00:00,12," walmart 3 for one stock split going into effect today after closing at 17556 on friday. Now pre-market trading, accounting for the stock split, with the retail giant trading just around 59 here in pre- market activity. If you look at the yahoo finance platform right now on yf plus, you can see that this stock is trading near the top of the 52 we range, but just at the bottom of the day range.",Walmart,WMT
112,834p9evBR48,"Broadcom earnings: There's more room for AI growth, analyst says",Yahoo Finance,2024-03-07 22:30:00+00:00,8,"Broadcom's first quarter results hit the wire and the shares down a quick 1.8%. The company sees its full year revenue at about $50 billion, so that's something we'll be watching as well. Part of the reason the stock has surged: investors seeing this as an ai play, and htan talks about that. that was, of course, n Nvidia and the other name was broadcom and you saw kind of the, the reaction or the move in the stock prices last year from those names. As you kind of going into 2024 here, that that the same story that you saw in 23 for broadc comp continues to build. angelo, what, what is that acquisition going to mean for broadcom's business going forward? yeah, i think it it it boosts the, the margin trajectory of this company. i think a lot of investors are going to want to know exactly where the opex number, is going to look like here over the next couple of quarters.",Broadcom,AVGO
113,WGksFVVuIxA,Berkshire Hathaway stock pulls back from record high on earnings,Yahoo Finance,2024-02-26 23:27:06+00:00,6,"um. berkshire has a really good insurance franchise in geico and a reinsurance franchise and as well as a commercial lines franchise and that really drove results. um, that plus higher investment income. i mean there are some some drags on on results um, and i think one of the reasons why the stock maybe a a little weak today is some concerns over burk shear's um utilities exposure. i think berkshire has a fairly satisfied investor based um. i could see a situation where, you know, sometime in the future perhaps their investor base pushes them to initiate a dividend. but my sense is that the majority of birkshire hathaway's shareholder base is a pretty satisfied bunch.",Berkshire,BRK-B
114,4yeCqUUD8b4,"Costco stock falls after missing Q2 revenue expectations, analyst says 'a really strong quarter'",Yahoo Finance,2024-03-08 16:52:54+00:00,23," costco shares are falling pre-market after missing analyst expectations for revenue in its second fiscal quarter. The big box retailer did, however, beat estimates in its same store sales, rising 5.8% compared to the 5% that was expected. joining us now for more on this result, more on these results. The consumer is still pretty strong, right, and and and that showed up in in the retail sales. management teams and companies seem to say that consumers are a bit more stretched than they have been over the past few years. so we could, i think we'll still continue to see the business performing well, but we do think that the valuation is stretched at the moment.",Costco,COST
115,kPS-wGgX3Ao,"Target stock rips higher on Q4 earnings, retailer announces membership",Yahoo Finance,2024-03-05 16:42:07+00:00,107,"Yahoo finance executive editor brian sai here to break down the quarter for safe sai. retailer posting a big profit beat in his quarterly results. cautious consumer spending more this holiday quarter. target chairman co brian cornell says: we are going back to growth mode this year. i'm curious, as because you, we have all talked about this in the past- just why hasn't target come out with a product like this earlier? right, there's been lots of talk about the fact that this could really be a driver here in sales in the long run. on a day like this, i'm thinking costco raking in millions of dollars on membership fee income. target's going to do the same.",Target,TGT
116,mdEdOk3Tv8A,Micron stock jumps on chip production for Nvidia GPUs,Yahoo Finance,2024-02-26 23:29:21+00:00,61, micron is a memory chipmaker which traditionally is seen as more of a commodity product and i think there were some questions among investors about what role the memory chip makers were going to play. micron says these are going to begin shipping in the second quarter of this year.,Micron,MU
117,POxLq7b49i8,"Investment advisor: Consol Energy stock is a buy, Chevron is not",Yahoo Finance,2024-03-06 23:07:13+00:00,25,"chevron has a um, um, 13% return on equity. cix has a 50%. so there's, you know, just mathematically those numbers are different, right, and so if you're talking about a trade, one to buy and one maybe to void. i think that's the opportunity. yeah, i mean, chevron's also trying to make a monster acquisition, so we could see, you could change, but you.",Chevron,CVX
118,bTFbkGn5ugA,Tesla stock falls over China concerns including BYD and other homegrown EV competition,Yahoo Finance,2024-03-05 18:38:47+00:00,11,"tesla shares tumbling to new multi-week lows on troubles in china now slowing china shipments and new price cuts in the region. For more on this, we want to bring in dan lovey, barkley's senior autos analyst. i think what we're seeing playing out is the, the broader theme that we've been talking about, which is that this is really a year about pivoting from supply constraints to demand constraints. i would say one thing that you've seen change a little bit with tesla is that, as opposed to last year, where there were sort of more open and wide price cuts from them. What we've seen really in in the last- call it six months is more. i would call it discreet- uh discounting, other forms of discounting.",Tesla,TSLA
119,pIgrmWs-q3U,Alphabet stock drops on analyst's AI warning,Yahoo Finance,2024-02-26 21:57:49+00:00,3,"Shares of google parent company alphabet. they are down today. that's after one analyst shared some concerns over the tech giant, milus analyst ben reus, highlighting that alphabet's missteps in ai may fuel the perception that google is an unreliable source for artificial intelligence. the analyst reiterated his hold rating on that company.",Alphabet,GOOGL
120,J_Nijmbcuh8,"Target stock soars, plus why higher income consumers are shopping at Walmart",Yahoo Finance,2024-03-05 23:02:02+00:00,107,"Finance executive editor brian sazy is here with his takeaways for the day. One retail stock is standing out to the upside, and that would be target. target also said they will be opening hundreds of stores throughout the next decade- about 30 this year, 30 next year- and they will continue at this pace. i going to ask you a question: are you signing off for the new target membership program? do you need that in your life? no, okay, and i think that's very telling. if you're an analyst, you're modeling millions of dollarars, julie. that is the average american shopper right there.",Target,TGT
121,J_Nijmbcuh8,"Target stock soars, plus why higher income consumers are shopping at Walmart",Yahoo Finance,2024-03-05 23:02:02+00:00,12," walmart opening and remodeling hundreds of stores. i caution people to just think before you start modeling that in, because it doesn't happen overnight. a higher income household is going to walmart. they no longer view walmart as a dumpy place to buy homegoods. that's why one more chairs have outperformed the past year.",Walmart,WMT
122,29PKjKGuEQY,Disney gets price target boost from Morgan Stanley,Yahoo Finance,2024-03-04 18:00:01+00:00,32,"Madison mills: A call out from morgan stanley raising their price target on the stock to 135 bucks a share from 110 madison mills is on the floor of the new york stock exchange. this could also be a sign that that joint venture between warner brothers, fox and disney is getting a bullish view on the street now.",Disney,DIS
123,T1P3LyssWvA,"Travel stocks for investors to watch: Delta, Marriott, Royal Caribbean",Yahoo Finance,2024-02-26 19:56:42+00:00,122,"Marriott is one of the top picks among analysts who are looking across the accommodations in the hotel industry across the street here. One huge theme to zero in on for marriott is going to be that rebound in corporate travel that we've been continuing to talk about, with the number of events that are set to be hosted and bookings that come along with those events.",Marriott,MAR
124,T1P3LyssWvA,"Travel stocks for investors to watch: Delta, Marriott, Royal Caribbean",Yahoo Finance,2024-02-26 19:56:42+00:00,238,"The company expects to grow capacity by the introduction of the utopia of the seas and silver ray in the first full year of service. The new ships not only elevate their vacation experiences, they said, and draw new customers to their brands. In 2024 they expect yields to grow 5 and a4 to 7 and a qu% driven by the performance of their entire fleet.",Royal Caribbean,RCL
125,-zzZk4ll1t8,"Nvidia, Meta, and Amazon are big three winners of earnings season",Yahoo Finance,2024-02-27 21:59:30+00:00,4,"Nvidia, amazon, meta- the big three winners of this earning season. Analysts- even this week, with barkley's out this morning- upping their target even more. When you're adding in big tech and adding in those high expectations, that's what's driving these targets higher.",Amazon,AMZN
126,wo1FfVuBark,Paramount's 'key focus' has turned to profitability: Analyst,Yahoo Finance,2024-02-29 22:14:44+00:00,482,"paramount shares climbing higher up just about 3 and a half% in the pre-market, after posting a surprise profit in the fourth quarter. boosted by a 69% jump in streaming revenue from just a year ago. Media giant also announcing that it expects to achieve profitability for paramount plus in 2025 in the us. um, so they're, they're definitely pushing more on the paramount plus advertising tier but, as i'm sure you all know, um, so are everyone else, and especially with amazon now in the marketplace and netflix ramping up. yeah, we do know it well. robert fishman, mo at nathanson, senior analyst.",Paramount,PARA
127,5t6MQCD9_eY,Amazon to join the Dow: A historical look at other company replacements on the exchange,Yahoo Finance,2024-02-25 17:00:04+00:00,215,"jared blicker is here with a look at how historical changes to the dow has affected the average. dow is the people's index. it might only be 30 stocks, but it goes back to the late 1800s, 1896, and it is a reference point in the market. dow has not hit 40,000 yet, but actually very recently.",Dow,DOW
128,5t6MQCD9_eY,Amazon to join the Dow: A historical look at other company replacements on the exchange,Yahoo Finance,2024-02-25 17:00:04+00:00,4,"amazon set to join the index in replacing walgreens boots alliance. we'll have to see if something similar happens with amazon and wal walgreen, uh, but we'll having to see in a few years. Amazon will be in the same index as Walgreens.",Amazon,AMZN
129,sZ2CkOI01K0,"Stifel upgrades Micron to Buy, diverges from Wall Street estimates",Yahoo Finance,2024-03-07 21:15:02+00:00,61," chipmaker micron is riding higher on a steel notes saying now is the time to buy upgrading it from a hold rating. Shares are up 3% after the price target was raised to $120 a share. on the flip side, i do quickly want to mention muho. the analysts over there saying they're concerned about you know, most of people we've talked of said we don't think it's a bubble.",Micron,MU
130,VbziVP02aeU,"Boeing’s deal with Spirit AeroSystems puts it on 'the path to normalization,' analyst says",Yahoo Finance,2024-03-06 19:21:46+00:00,78,"Shares of boeing down over 20% roughly since the start of 2024. downward trend mainly coming after the incident in early january where a side panel was blown out midair on an alaskan airlines flight. dubai carrier emirates now voicing its support of Boeing's potential takeover of spirit aeros systems. um, because really the number one thing we've been looking at at boeing is there's this risk premium that's built into the stock. i think this would sort of help, you know, lower that risk premium as we go down to live and so looking for an offset.",Boeing,BA
131,nyFM1URefro,"HP CEO on Q1 revenue decline: We expect the PC market to grow, demand has slowed down",Yahoo Finance,2024-02-28 22:20:35+00:00,272," hp inc. revenue missing estimates here. First quter free cash flow at only $25 million versus the billion dollars that analysts have been anticipating. Second quarter forecast of adjusted earnings per share of 76 to 86 cents is uh compares with the 82 cents that analysts had been forecasting here.  i think the changes that we see happening in the technology space driven by ai are opening a tremendous opportunity for hp. i think ai is is a sar disruption that is going to enable the creation of significant value that today we really don't understand how it will h. i am more optimistic now than i have been in the many, many years before hri.",HP,HPQ
132,ktpyFHMC3ts,Salesforce is really showing their dedication...to rewarding investors: Macquarie's Fred Havemeyer,Yahoo Finance,2024-02-29 19:59:55+00:00,26,"salesforce reported an earnings beat and announced its first ever dividend, but forecasted weaker than expected fiscal full year revenue. Chief financial officer noted that salesforce was not factoring in material contribution from ai products, expecting to see it in two or three years. For more on how investors can discern the early beneficiaries of generative ai, let's bring in fred havm, who is the head of us ai software research. Fred hav meer mcquary: Who is winning the battle of the co-pilot right now? i think it's so early days that it remains an open field. i think, in terms of the technology, open ai still appears to be in a position where they're serving the best models.",Salesforce,CRM
133,c_uA3BGb4aU,Target: 5 biggest risks for stock amid challenges including competition and inflation,Yahoo Finance,2024-03-05 21:16:10+00:00,107, ,Target,TGT
134,k5AvO39RtXc,Domino's growth has 'more to come' amid Uber Eats deal,Yahoo Finance,2024-02-26 18:13:04+00:00,383,"  uh, but keep in mind, if consumers are looking for a value, um, and and ways to leverage their dollars, really there is no better way than the pizza category, and domino's is the leader on value. so you could feed a family of four for 25- 30 bucks. um, you struggle to do that in any other qsr or any other restaurant out there.",Domino's,DPZ
135,k5AvO39RtXc,Domino's growth has 'more to come' amid Uber Eats deal,Yahoo Finance,2024-02-26 18:13:04+00:00,50,,Uber,UBER
136,vAA-XZtSkRc,"Salesforce Q4 earnings top estimates, revenue outlook disappoints",Yahoo Finance,2024-02-28 21:45:08+00:00,26,"Salesforce's fourth quarter earnings per share came out 2 pennies above what analyst had been anticipating. The company expects as most $38 billion in revenue. After hours, the stock is down about 6% and after hours- obviously this is another name that had this tremendous run into this print.",Salesforce,CRM
137,cwG022pJa5k,@Walmart’s 3-for-1 stock split: What to know #shorts,Yahoo Finance,2024-02-25 04:30:21+00:00,12,,Walmart,WMT
